{
    "$schema": "./test-case.schema.json",
    "test_id": "session-stale-view-want-after-heads-replace",
    "description": "A reader should fail sync when the seed replaces advertised heads and then requests a view that was only reachable from the withdrawn root set.",
    "category": "negative",
    "topology": "sim/topologies/session-stale-view-want-after-heads-replace.example.json",
    "fixture_set": "fixtures/object-sets/session-stale-view-want-after-heads-replace",
    "execution_mode": "single-process",
    "expected_result": "fail",
    "expected_outcomes": [
        "stale-view-want-after-heads-replace-rejected",
        "no-invalid-index-write"
    ],
    "assertions": [
        {
            "assertion_id": "stale-view-want-after-heads-replace-rejected",
            "description": "Reader rejects WANT because replace=true withdrew the old sync roots before the stale view object was requested again.",
            "severity": "error"
        },
        {
            "assertion_id": "no-invalid-index-write",
            "description": "Reader does not keep writing sync state after the withdrawn-root view WANT violation.",
            "severity": "error"
        }
    ],
    "notes": [
        "Extends the simulator matrix with a post-HELLO root-set replacement fault on the VIEW_ANNOUNCE optional-message path.",
        "The harness keeps the normal view-capable peer-store transcript but injects a replacing HEADS plus a stale view WANT before BYE."
    ]
}
